{
  "consumer_verification_digest": "6f2e1f615a72e743df7b26a5feece1f37296e106e26754ae8ca7f9f5a9311ea1",
  "generation_id": "generation-34edddda5aee96dc7236aaf3",
  "pin_id": "stage27-long-reader",
  "product_id": "orders-migration",
  "proof_manifest_digest": "3f9820894bcd62ac92db48b10c9a128440f20096129cac0c83b06b957e7488a9",
  "revision": 1,
  "route": "GENERATION",
  "table_map": {
    "order_items": {
      "identifier": "stage23.cb_g_017d6eea93a471d8.order_items",
      "manifest_list_digest": "0a83a2d4ccaba315a74be9403e740295f524f5411e230b63780ddd50c875f8e1",
      "row_count": 66,
      "snapshot_id": "9181776194235418564"
    },
    "orders": {
      "identifier": "stage23.cb_g_017d6eea93a471d8.orders",
      "manifest_list_digest": "e1ee2a7e74c0659560aa26a8c94c4bc58332ab4419a2d60f815a46b2e1df4d8b",
      "row_count": 6,
      "snapshot_id": "5164862605917836293"
    }
  },
  "table_map_digest": "91d02e198cb3d843c5441361c9eb65ba1aba74117d1a8e8338a90ff3a02e2f84",
  "tables": {
    "order_items": {
      "identifier": "stage23.cb_g_017d6eea93a471d8.order_items",
      "manifest_list_digest": "0a83a2d4ccaba315a74be9403e740295f524f5411e230b63780ddd50c875f8e1",
      "representative_key": "item-004-001",
      "row_count": 66,
      "snapshot_id": "9181776194235418564",
      "table": "order_items"
    },
    "orders": {
      "identifier": "stage23.cb_g_017d6eea93a471d8.orders",
      "manifest_list_digest": "e1ee2a7e74c0659560aa26a8c94c4bc58332ab4419a2d60f815a46b2e1df4d8b",
      "representative_key": "order-001",
      "row_count": 6,
      "snapshot_id": "5164862605917836293",
      "table": "orders"
    }
  },
  "verification": "GENERATION_CONSISTENT_READ_VERIFIED"
}
